{"schema_version":"0.1","batch_id":"unit-batch-analysis","version":1,"question":"Does every preregistered Profile retain its outcome across coverage and perturbation?","primary_variable":{"name":"batch_profile","source":"unit-fixture","unit":"profile"},"dimensions":[{"name":"cache-mode","levels":[{"id":"off","value":false},{"id":"on","value":true}]},{"name":"queue-mode","levels":[{"id":"off","value":false},{"id":"on","value":true}]}],"profiles":[{"id":"baseline","cells":{"cache-mode":"off","queue-mode":"off"},"plan_sha256":"aaaaaaaaaaaaaaaaaaaaaaaaaaaaaaaaaaaaaaaaaaaaaaaaaaaaaaaaaaaaaaaa","realization":{"subject_version":"profile-baseline","subject_source_ref":"fixtures/profile-baseline","target_root":"fixtures/profile-baseline","static_root_fingerprint":"1111111111111111111111111111111111111111111111111111111111111111"},"estimated_memory_mb":256},{"id":"queue-only","cells":{"cache-mode":"off","queue-mode":"on"},"plan_sha256":"bbbbbbbbbbbbbbbbbbbbbbbbbbbbbbbbbbbbbbbbbbbbbbbbbbbbbbbbbbbbbbbb","realization":{"subject_version":"profile-queue-only","subject_source_ref":"fixtures/profile-queue-only","target_root":"fixtures/profile-queue-only","static_root_fingerprint":"2222222222222222222222222222222222222222222222222222222222222222"},"estimated_memory_mb":256},{"id":"cache-only","cells":{"cache-mode":"on","queue-mode":"off"},"plan_sha256":"cccccccccccccccccccccccccccccccccccccccccccccccccccccccccccccccc","realization":{"subject_version":"profile-cache-only","subject_source_ref":"fixtures/profile-cache-only","target_root":"fixtures/profile-cache-only","static_root_fingerprint":"3333333333333333333333333333333333333333333333333333333333333333"},"estimated_memory_mb":256},{"id":"combined","cells":{"cache-mode":"on","queue-mode":"on"},"plan_sha256":"dddddddddddddddddddddddddddddddddddddddddddddddddddddddddddddddd","realization":{"subject_version":"profile-combined","subject_source_ref":"fixtures/profile-combined","target_root":"fixtures/profile-combined","static_root_fingerprint":"4444444444444444444444444444444444444444444444444444444444444444"},"estimated_memory_mb":256}],"execution_policy":{"order_algorithm":"SHA256_RANK_V1","seed":20260811,"perturbation_repetitions":1,"max_parallel":2,"memory_budget_mb":512,"preflight_between_waves":true,"cleanup_between_waves":true},"schedule":[{"slot_id":"coverage-01","phase":"COVERAGE","repetition":0,"wave":1,"position":1,"profile_id":"baseline"},{"slot_id":"coverage-02","phase":"COVERAGE","repetition":0,"wave":2,"position":1,"profile_id":"queue-only"},{"slot_id":"coverage-03","phase":"COVERAGE","repetition":0,"wave":3,"position":1,"profile_id":"cache-only"},{"slot_id":"coverage-04","phase":"COVERAGE","repetition":0,"wave":4,"position":1,"profile_id":"combined"},{"slot_id":"perturbation-01","phase":"PERTURBATION","repetition":1,"wave":1,"position":1,"profile_id":"combined"},{"slot_id":"perturbation-02","phase":"PERTURBATION","repetition":1,"wave":1,"position":2,"profile_id":"cache-only"},{"slot_id":"perturbation-03","phase":"PERTURBATION","repetition":1,"wave":2,"position":1,"profile_id":"baseline"},{"slot_id":"perturbation-04","phase":"PERTURBATION","repetition":1,"wave":2,"position":2,"profile_id":"queue-only"}],"outcomes":[{"assertion_id":"console-errors-zero","expected_actual":{"baseline":0,"queue-only":0,"cache-only":0,"combined":1}}],"limits":["Profile-level observations do not prove component-level causality or statistical interaction.","A wave is a sealed resource envelope and does not prove real runtime overlap."],"reproduction_steps":["Run every slot in the sealed order."],"cleanup_steps":["Verify every wave cleanup boundary."],"seal":{"algorithm":"sha256","digest":"892920595ab55586a60af83f1da6a7708cc99c4f8e12ed119fc0d99f3e809ba2"}}